by,score,time,url,text,id,type,title,kids,descendants
traviskuhl,5,1714833409,https://arstechnica.com/cars/2024/05/chaos-at-tesla-what-analysts-think-about-elon-musks-cuts-and-layoffs/,,40257997,story,What's happening at Tesla? Here's what experts think,"[40258168, 40258085]",1
Brajeshwar,442,1714749256,https://newatlas.com/energy/natron-sodium-ion-battery-production-startt/,,40248627,story,Lithium-free sodium batteries exit the lab and enter US production,"[40249330, 40249934, 40248806, 40250492, 40249660, 40251306, 40252011, 40251743, 40250504, 40249147, 40249153, 40249113, 40251023, 40250358, 40249038, 40253996, 40251058, 40250098, 40249838, 40254020, 40248950, 40250433, 40254143, 40251224, 40249181, 40251686, 40250955, 40249186, 40252361, 40251556, 40251333, 40252060, 40249620]",354
bms2297,113,1714691157,https://www.mattcutts.com/blog/google-synonyms/,,40242335,story,More info about synonyms at Google (2010),"[40242336, 40242685, 40242519, 40243105, 40249641, 40242448, 40242744, 40242743]",48
gnabgib,75,1714783383,https://theconversation.com/how-much-time-should-you-spend-sitting-versus-standing-new-research-reveals-the-perfect-mix-for-optimal-health-228894,,40253868,story,How much time should you spend sitting versus standing?,"[40254734, 40254274, 40254315, 40254648, 40254323, 40256705, 40256415, 40254448, 40256753, 40254341]",60
rntn,31,1714754436,https://www.techdirt.com/2024/05/03/court-supports-ny-states-quest-to-require-15-broadband-for-poor-people-much-to-big-telecoms-horror/,,40249601,story,"Court Supports NY's Requiring $15 Broadband for Poor, to Big Telecom's Horror",[40249665],1
T-A,248,1714606884,https://royalsocietypublishing.org/doi/10.1098/rsos.231906,,40230988,story,Horizontal running inside circular walls of Moon settlements,"[40231589, 40231363, 40235024, 40232377, 40231980, 40232996, 40232323, 40234453, 40232403, 40232315, 40237248, 40232536, 40232121, 40233425, 40231180, 40231394, 40232140, 40234850, 40231245, 40231298]",142
Brajeshwar,49,1714737133,https://www.theverge.com/2024/5/2/24146743/university-of-tokyo-atacama-observatory-telescope-highest-altitude-infrared,,40246601,story,The highest observatory in the world just opened in Chile,[40248836],6
Brajeshwar,19,1714737142,https://techcrunch.com/2024/05/02/google-will-now-show-labels-in-play-store-to-denote-official-government-apps/,,40246603,story,Google will now show labels in Play Store to denote official government apps,,0
conanxin,8,1714828936,https://www.oreilly.com/radar/rising-tide-rents-and-robber-baron-rents/,,40257470,story,Rising Tide Rents and Robber Baron Rents,"[40258218, 40257914]",1
MiguelX413,172,1714771257,https://bsky.app/profile/silverwuffamute.bsky.social/post/3kqbd476nvk2i,,40252525,story,Discord Applying Forced Arbitration - opt-out before it is too late!,"[40253155, 40258089, 40253921, 40252840, 40254801, 40253282, 40252884, 40253649, 40253035, 40254735, 40252570, 40254267, 40252720, 40253371, 40254335, 40255869, 40254400, 40253248, 40253608, 40254599, 40252632, 40253119, 40252728, 40252630]",92
InitEnabler,641,1714488885,https://pyinfra.com/,,40211655,story,Pyinfra: Automate Infrastructure Using Python,"[40212701, 40212449, 40215908, 40213558, 40212747, 40214789, 40212984, 40215385, 40218145, 40212897, 40214563, 40228934, 40218169, 40213946, 40213688, 40212026, 40221021, 40232291, 40213530, 40220186, 40213062, 40213061, 40221616, 40215062, 40219627, 40215879, 40220525, 40213268, 40212008, 40219060, 40212023, 40212761, 40221893, 40212588, 40214189, 40214753, 40213412, 40222378]",216
keepamovin,39,1714729627,https://www.bbc.com/future/article/20240501-the-new-zealand-city-with-a-labyrinth-of-underground-caves,,40245843,story,"Auckland, New Zealand: A city with a labyrinth of underground caves","[40246245, 40247185, 40247803, 40246219, 40254548, 40247830, 40246097, 40253221]",25
jnord,94,1714690025,https://blog.trailofbits.com/2024/05/02/the-life-and-times-of-an-abstract-syntax-tree/,,40242224,story,The life and times of an Abstract Syntax Tree,"[40242527, 40245648, 40242584, 40245237, 40243945, 40243118, 40246757, 40250361, 40247581, 40247295, 40243264]",28
veryluckyxyz,94,1714697726,https://www.lesswrong.com/posts/jGuXSZgv6qfdhMCuJ/refusal-in-llms-is-mediated-by-a-single-direction,,40242939,story,Refusal in LLMs is mediated by a single direction,"[40248418, 40251554, 40249812, 40253092, 40248781, 40254915]",16
thelastgallon,18,1714784778,https://electrek.co/2024/05/02/fully-electric-10000-ton-container-ship-begun-service50000-kwh-batteries/,,40253973,story,Electric 10000 ton container ship has begun service with over 50MWh in batteries,"[40254035, 40256805, 40255305, 40257451, 40254933]",6
neversaydie,239,1714666145,https://www.bbc.co.uk/news/science-environment-68942123,,40237855,story,Wild orangutan seen healing his wound with a plant,"[40243152, 40239355, 40243943, 40246066, 40244974, 40238456, 40250703, 40248957, 40242795, 40239333, 40239693, 40238405, 40238562, 40238955, 40241695, 40238558]",148
amarcheschi,13,1714822978,https://www.foxglove.org.uk/2024/05/02/legal-challenge-to-amazon-uks-new-one-click-to-quit-the-union-tool/,,40256908,story,"Legal challenge to Amazon UK's new ""one-click to quit the union"" tool","[40256945, 40257406, 40257023, 40256938, 40256924]",6
bx376,27,1714719175,https://techcrunch.com/2024/04/27/your-team-sucks/,,40244911,story,Investors won't give you the real reason they are passing on your startup,"[40257999, 40251010, 40254038, 40252560, 40252456, 40252577, 40251792, 40250899]",17
apitman,3,1714758526,https://github.com/rivo/tview,,40250318,story,"Tview – Golang Terminal UI library with rich, interactive widgets",[40258270],0
tankfeeder,30,1714738686,https://craigbarnes.gitlab.io/dte/,,40246818,story,Dte – Text Editor,[40252576],1
TMWNN,100,1714782765,https://www.sfchronicle.com/sf/article/s-f-office-building-value-19438429.php,,40253831,story,"Value of one of S.F.'s biggest buildings plunges by 80% after Uber, Block leave","[40254179, 40254227, 40257364, 40254539, 40254386, 40254099, 40254345, 40253893, 40255953, 40254411, 40254459, 40253997, 40253833, 40254119]",101
pixelbyindex,83,1714626575,https://godotengine.org/article/dev-snapshot-godot-4-3-dev-6/,,40232896,story,Godot 4.3 Dev Snapshot 6 Updates,"[40249894, 40250016, 40251085, 40232907]",12
coloneltcb,419,1714757126,https://www.statnews.com/2024/05/01/wheelchair-repair-delay-numotion-national-seating-mobility/,,40250056,story,"As private equity dominates wheelchair market, users wait months for repairs","[40252212, 40251683, 40252463, 40252205, 40254154, 40253669, 40251864, 40252138, 40253318, 40251992, 40252773, 40252341, 40251677, 40253636, 40253898, 40252941, 40251778, 40253708, 40252166, 40253953, 40252229, 40251661, 40252365, 40252182, 40252489, 40251440, 40251719, 40252083, 40253878, 40253312]",284
demegire,178,1714660578,https://chromewebstore.google.com/detail/wiki-journey/lehenbcbjcnkhkikgopniimobmmdcfog,"Wiki Journey tracks your daily Wikipedia rabbit holes in a tree format.<p>Available on Firefox and Chrome:
<a href=""https:&#x2F;&#x2F;addons.mozilla.org&#x2F;en-US&#x2F;firefox&#x2F;addon&#x2F;wiki-journey&#x2F;"" rel=""nofollow"">https:&#x2F;&#x2F;addons.mozilla.org&#x2F;en-US&#x2F;firefox&#x2F;addon&#x2F;wiki-journey&#x2F;</a>
<a href=""https:&#x2F;&#x2F;chromewebstore.google.com&#x2F;detail&#x2F;wiki-journey&#x2F;lehenbcbjcnkhkikgopniimobmmdcfog"" rel=""nofollow"">https:&#x2F;&#x2F;chromewebstore.google.com&#x2F;detail&#x2F;wiki-journey&#x2F;lehenb...</a><p>It&#x27;s open source, feel free to contribute!
<a href=""https:&#x2F;&#x2F;github.com&#x2F;demegire&#x2F;wiki-journey"">https:&#x2F;&#x2F;github.com&#x2F;demegire&#x2F;wiki-journey</a>",40236797,story,Show HN: An extension to track your Wikipedia adventures,"[40239180, 40237595, 40237819, 40237610, 40237439, 40237620, 40238302, 40238459, 40239368, 40243600, 40237297, 40238075, 40244567, 40238140, 40244785, 40237505, 40237427, 40237267, 40238445, 40240962, 40237700, 40237226, 40237670, 40237207, 40237323, 40237783]",62
dshipper,124,1714748759,https://every.to/chain-of-thought/i-spent-24-hours-with-github-copilot-workspaces,,40248514,story,I Spent 24 Hours with GitHub Copilot Workspaces,"[40249388, 40249675, 40250133, 40249425, 40256827, 40250002, 40249924, 40251140, 40249935, 40250300, 40249167, 40249408, 40250945, 40250937, 40255070, 40249616, 40249654, 40249421, 40250159, 40250246, 40250265, 40254210, 40249353]",71
toomuchtodo,238,1714757999,https://www.thebignewsletter.com/p/an-oil-price-fixing-conspiracy-caused,,40250226,story,Evidence of price-fixing in the oil industry?,"[40251655, 40252126, 40251962, 40251369, 40251117, 40251581, 40253941, 40251357, 40252902, 40253449, 40251595, 40251005, 40250965, 40251458, 40250913, 40251252]",147
fagnerbrack,118,1714748826,https://frontendmasters.com/blog/what-you-need-to-know-about-modern-css-spring-2024-edition/,,40248530,story,What You Need to Know about Modern CSS (Spring 2024 Edition),"[40252861, 40250337, 40252964, 40250197, 40252647, 40250131, 40253145, 40253422, 40252351, 40253710]",19
molli,16,1714735805,https://chromewebstore.google.com/detail/scrix-audio-to-text-trans/aapbilffnkjhifbaejfmcjjcpdpadjfm,,40246445,story,Show HN: ScriX – Chrome extension summarizing speech into bullet points,"[40247850, 40255602, 40248359]",13
thesuperbigfrog,33,1714788786,https://blog.antoyo.xyz/rustc_codegen_gcc-progress-report-32,,40254259,story,Rustc_codegen_GCC: Progress Report #32,[40254272],2
axeleratorr,90,1714521847,https://demo.gocodestudio.com/studio/,"I built a web-based app for building websites. The main unique features are:<p>1. The ability to copy and paste any HTML and CSS into the editor with no limits. I was never able to find another app that could do this without some form of limitation.<p>2. CSS filtering, which means you can click on an element to view and edit the CSS selectors and rules that apply to that element alone. In many cases I&#x27;ve found CSS naming conventions like BEM to become irritating at certain scales, so this is an alternative solution. This part of the app needs some more development work but the concept is there.<p>3. Lightweight UI that leaves most of the development to code. I tend to get annoyed with UI&#x27;s that try and address every styling possibility because it feels like I&#x27;m spending too much time learning the app, when it would have been faster to just type a couple lines of CSS.<p>I would love to hear your feedback. There is no sign up and is <i>not</i> mobile-friendly.<p>Hit [C] on the keyboard to open the code editor or hit the &quot;&lt;&gt;&quot; icon in the toolbar.",40217998,story,Show HN: Browser-based web design platform with code import and CSS filters,"[40243863, 40245116, 40247188, 40222139, 40244210, 40247998, 40224821, 40244031]",17
jshchnz,108,1714690732,https://www.emergetools.com/deep-dives/rabbit-r1,,40242297,story,An analysis of the Rabbit R1  APK,"[40243918, 40243034, 40242840, 40242925, 40242909, 40242770, 40243907, 40243324, 40244064, 40243739, 40242928, 40243815, 40242727, 40243400, 40242779, 40243733, 40243003]",107
jjgreen,87,1714554444,https://tex.stackexchange.com/questions/716175/possible-to-dot-your-is-with-hearts,,40221035,story,Possible to dot your Is with hearts?,"[40238048, 40240259, 40243485, 40234988]",9
xnhbx,23,1714791655,https://asia.nikkei.com/Business/Technology/Japan-ministry-asks-Line-Yahoo-operator-to-shed-Naver-influence,,40254472,story,"Japan ministry asks Line, Yahoo operator to shed Naver influence",,0
zdw,40,1714776862,https://www.timeextension.com/features/flashback-how-the-kindness-of-sega-saved-nvidia-from-going-under,,40253245,story,How the Kindness of Sega Saved Nvidia from Going Under,"[40256354, 40255555, 40255662, 40256658]",6
ankitg12,116,1714735422,https://www.nextplatform.com/2024/05/02/how-to-make-more-money-renting-a-gpu-than-nvidia-makes-selling-it/,,40246398,story,How to Make More Money Renting a GPU Than Nvidia Makes Selling It,"[40247274, 40248579, 40247099, 40247225, 40246843, 40246812, 40249175, 40248845, 40247229]",56
thunderbong,5,1714750097,https://novum.substack.com/p/the-internet-is-like-a-city,,40248795,story,The Internet Is Like a City (But Not in the Way You'd Think),[40249078],1
zh2408,7,1714749854,https://github.com/Cocoon-Data-Transformation/cocoon,"The problem we solve is profiling tables: this is the initial step where you need to understand the table and identify any anomalies.<p>During the process, many small decisions require semantic understanding. For example, missing values are normal for &#x27;deathdate&#x27; (still alive) but abnormal for &#x27;name.&#x27; For outliers, 100 for ages is fine, but some are -1, which is impossible! We use LLMs to semantically understand your tables and detect anomalies.<p>You can try it by uploading a CSV, and we will email back the profile: <a href=""https:&#x2F;&#x2F;cocoon-data-transformation.github.io&#x2F;page&#x2F;"" rel=""nofollow"">https:&#x2F;&#x2F;cocoon-data-transformation.github.io&#x2F;page&#x2F;</a><p>Let me know your feedback. Thanks!",40248744,story,Show HN: An open-source tool that semantically profiles your data using LLMs,[40249297],2
ethanholt1,41,1714723870,https://www.pcmag.com/news/yikes-windows-10-sees-uptick-as-windows-11-share-decreases,,40245363,story,Windows 10 share increases while Windows 11 share decreases,"[40250597, 40245551, 40247677, 40254482, 40249710, 40255359, 40255800, 40247721, 40247505, 40252567, 40247530, 40248608, 40252814, 40255263]",28
microflash,7,1714765157,https://www.nngroup.com/articles/content-design-systems/,,40251477,story,Content Standards in Design Systems,,0
robin_reala,14,1714803049,https://bugzilla.mozilla.org/show_bug.cgi?id=1894735,,40255307,story,ReCAPTCHA is broken for [some|most|all] Windows users,"[40255343, 40257502, 40257637, 40255516, 40257487, 40257520]",5
jchanimal,18,1714661237,http://axisofeval.blogspot.com/2024/05/delimited-generators.html,,40236923,story,Delimited Generators – A more natural API for JS generators,"[40240858, 40246837, 40241428, 40241313, 40240785, 40242285, 40241068, 40240905]",26
beardyw,22,1714806257,https://www.theguardian.com/science/article/2024/may/03/video-of-suns-surface-captures-solar-rain-eruptions-and-coronal-moss,,40255566,story,"Video of sun's surface shows solar rain, eruptions and coronal moss","[40257014, 40257566, 40256161, 40256197]",4
JonoBB,212,1714636334,https://sign.dropbox.com/blog/a-recent-security-incident-involving-dropbox-sign,,40233746,story,A recent security incident involving Dropbox Sign,"[40235548, 40233987, 40233976, 40236529, 40233944, 40237357, 40236130, 40233951, 40236773, 40234000, 40248780, 40234258, 40234654, 40234161, 40234014]",67
chapulin,65,1714670503,https://www.quantamagazine.org/pleasure-or-pain-he-maps-the-neural-circuits-that-decide-20240416/,,40238788,story,Pleasure or pain? He maps the neural circuits that decide,"[40243987, 40240368, 40245539, 40243732, 40241406, 40241190]",30
hubraumhugo,127,1714624911,https://geospy.ai/,,40232755,story,AI Photo Geolocation,"[40237191, 40236685, 40235940, 40236219, 40238198, 40236263, 40241101, 40234732, 40235689, 40237464, 40234638, 40240471, 40234735, 40235448, 40235438, 40234830, 40235152, 40234525, 40236189, 40235180, 40235739, 40238271, 40236956, 40236610, 40238922, 40236868, 40240337, 40234576, 40236820, 40240862, 40242418, 40234763, 40235483, 40236069, 40236765, 40237195, 40236135, 40236972, 40235622, 40238088, 40235067, 40235860, 40240491, 40235687, 40234806, 40235441, 40237100, 40237662, 40237733, 40234958, 40238704, 40235252, 40234795, 40237557, 40240276, 40240627, 40237581, 40234635]",101
mmastrac,119,1714617332,https://www.atlasobscura.com/articles/vivianite-blue-human-remains,,40232171,story,A blue mineral that grows on buried bodies and confuses archaeologists (2016),"[40234978, 40235763, 40235092, 40240554, 40239816, 40235288, 40239836, 40236525, 40243454, 40237703, 40237580, 40235321]",74
sohkamyung,92,1714723699,https://www.theregister.com/2024/05/03/on_call/,,40245348,story,"I can fix this PC, boss, but I'll need to play games for hours to do it","[40247273, 40246789, 40256350, 40246954, 40247014, 40247872, 40246702, 40246846]",35
camel-cdr,36,1714589210,https://cpldcpu.wordpress.com/2024/05/01/decapsulating-the-ch32v203-reveals-a-separate-flash-die/,,40227528,story,Decapsulating the CH32V203 Reveals a Separate Flash Die,[40249194],1
ilamont,8,1714766477,https://www.bloomberg.com/news/articles/2024-05-02/huawei-secretly-backs-us-based-research-with-millions-in-prizes-through-dc-group,,40251745,story,"Huawei Secretly Backs US Research, Awarding Millions in Prizes",,0
zdw,73,1714666745,https://www.canada.ca/en/conservation-institute/services/conservation-preservation-publications/canadian-conservation-institute-notes/longevity-recordable-cds-dvds.html,,40237984,story,"Longevity of Recordable CDs, DVDs and Blu-Rays (2020)","[40239553, 40240210, 40239666, 40240326, 40241094, 40240958, 40239492, 40239586, 40240219, 40240990, 40240406, 40241825, 40240619, 40239501, 40240694, 40241403, 40239503, 40239524]",54
CTOSian,65,1714725057,https://github.com/kuba2k2/firefox-webserial,,40245463,story,Firefox Webserial Addon,"[40249296, 40247510, 40248978, 40250739, 40247439]",53
pepys,74,1714621218,https://blogs.bl.uk/digitisedmanuscripts/2024/04/a-knights-tale.html,,40232466,story,A knight's tale,"[40242407, 40238472, 40239785, 40238157, 40242279, 40239296, 40243071, 40239869, 40240480]",36
belter,10,1714831926,https://techcrunch.com/2024/05/02/eu-csam-scanning-council-proposal-flaws/,,40257812,story,EU plan to force apps to scan for CSAM risks millions of false positives,[40257816],0
Brajeshwar,74,1714755989,https://www.carbonbrief.org/co2-removal-gap-shows-countries-lack-progress-for-1-5c-warming-limit/,,40249876,story,CO2 removal 'gap' shows countries 'lack progress' for 1.5C warming limit,"[40250156, 40252208, 40250329, 40251070, 40250694, 40251191, 40250823, 40252810, 40252305, 40250709, 40254672, 40252745, 40254159, 40252424, 40251239, 40250061]",76
Tomte,358,1714665643,https://crypto.stanford.edu/~dabo/courses/OnlineCrypto/,,40237745,story,Online Cryptography Course (2017),"[40239098, 40238029, 40238257, 40239823, 40238436, 40239088, 40239391, 40240615, 40240114, 40238891, 40243688, 40238221, 40239911, 40238873, 40239770, 40239884, 40240546, 40239564, 40239020, 40240105, 40238245, 40240167, 40239786, 40241770, 40239876, 40238545, 40241971]",56
altilunium,5,1714717463,https://github.com/enzet/map-machine,,40244729,story,Map Machine,,0
e2e4,232,1714685082,https://techcrunch.com/2024/05/02/they-thought-they-were-joining-an-accelerator-instead-they-lost-their-startups/,,40241525,story,They thought they were joining an accelerator – instead they lost their startups,"[40242332, 40241878, 40243153, 40243461, 40241838, 40242209, 40253761, 40242803, 40246783, 40243746, 40242828, 40243196, 40243371, 40243036, 40242137, 40242671, 40245646, 40243267, 40242856, 40244233, 40246835, 40243271, 40242313, 40243059, 40243307, 40243069, 40241973, 40241765, 40246661, 40241747]",152
Hooke,12,1714658650,https://publicdomainreview.org/essay/richard-owen-and-victorian-literature,,40236462,story,Professor Megalow's Dinosaur Bones: Richard Owen and Victorian literature,,0
jasondavies,126,1714557887,https://research.paulengstler.com/invisible-stitch/,,40221345,story,Invisible Stitch: Generating Smooth 3D Scenes with Depth Inpainting,"[40234184, 40231106]",5
wegwerff,346,1714498992,https://mgree.github.io/ffs/,,40213731,story,The File Filesystem (2021),"[40220211, 40215710, 40216398, 40214516, 40214962, 40216762, 40214576, 40220409, 40214271, 40214524, 40226898, 40220821, 40225294, 40237202, 40233272, 40215763, 40214230, 40217942, 40216715, 40215480, 40219028, 40215697, 40214314]",101
rntn,27,1714737359,https://www.techdirt.com/2024/05/02/was-there-a-trojan-horse-hidden-in-section-230-all-along-that-could-enable-adversarial-interoperability/,,40246642,story,Is There Language in Section 230 That Could Enable Adversarial Interoperability?,"[40247711, 40246674, 40249528]",4
elijahbenizzy,39,1714656159,https://github.com/DAGWorks-Inc/hamilton/tree/main/ui,"Hey HN – Stefan and Elijah here from DAGWorks (<a href=""http:&#x2F;&#x2F;dagworks.io&#x2F;"">http:&#x2F;&#x2F;dagworks.io&#x2F;</a>, YC W23).<p>If you don’t remember us from our previous HN launch (<a href=""https:&#x2F;&#x2F;news.ycombinator.com&#x2F;item?id=35056903"">https:&#x2F;&#x2F;news.ycombinator.com&#x2F;item?id=35056903</a>), we’re the authors of Hamilton (<a href=""https:&#x2F;&#x2F;github.com&#x2F;dagworks-inc&#x2F;hamilton"">https:&#x2F;&#x2F;github.com&#x2F;dagworks-inc&#x2F;hamilton</a>), an open-source library for building self-documenting, modular dataflows in python that works for data, ML, LLM pipelines, &amp; even web-workflows.<p>We’ve been developing this UI for a while and we’re excited to say we open-sourced it! It comes out of the box with the following capabilities, and only requires a single line code change to get:<p>1. Execution + metadata capture, e.g. automatic code profiling<p>2. Data&#x2F;artifact observability, e.g. summary statistics over dataframes, pydantic objects, etc...<p>3. Lineage &amp; provenance of data, e.g. quickly see what is upstream &amp; downstream of code&#x2F;data.<p>4. Asset&#x2F;transform catalog, e.g. search &amp; find if feature transforms&#x2F;metrics&#x2F;datasets&#x2F;models exist and where they’re used.<p>While the UI currently only self-populates for Hamilton dataflows, we’re looking to expand to other frameworks (we’d love your feedback!).<p>Check out the following video for an overview: <a href=""https:&#x2F;&#x2F;www.youtube.com&#x2F;watch?v=0VIVSeN7Ij8"" rel=""nofollow"">https:&#x2F;&#x2F;www.youtube.com&#x2F;watch?v=0VIVSeN7Ij8</a>, as well as the documentation: <a href=""https:&#x2F;&#x2F;hamilton.dagworks.io&#x2F;en&#x2F;latest&#x2F;concepts&#x2F;ui&#x2F;"">https:&#x2F;&#x2F;hamilton.dagworks.io&#x2F;en&#x2F;latest&#x2F;concepts&#x2F;ui&#x2F;</a>.<p>We’re looking for feedback&#x2F;adopters – feel free to reach out if you have any questions!",40235944,story,"Show HN: Hamilton's UI – observability, lineage, and catalog for data pipelines","[40237169, 40244558, 40237525, 40244753, 40249414]",10
alanpham,69,1714790311,,"As a designer, I use Lorem Ipsum a lot but none satisfied me. They are either too slow or too clunky.<p><a href=""https:&#x2F;&#x2F;loremcopy.com&#x2F;"" rel=""nofollow"">https:&#x2F;&#x2F;loremcopy.com&#x2F;</a><p>It&#x27;s a weekend project so why not (•‿•)<p>Also, I am new here. I didn&#x27;t know about Hacker News before. Glad to meet you all.",40254384,story,Show HN: I hate online Lorem Ipsum Generator so I made my own,"[40254455, 40255529, 40255741, 40254682, 40254838, 40255498, 40255025, 40255999, 40257766, 40255748, 40255594, 40255867, 40255747, 40254495, 40256261, 40254567, 40255143, 40254878, 40254559, 40255742, 40254621, 40254807, 40255639, 40254430]",53
PaulHoule,180,1714686264,https://www.anandtech.com/show/21373/tsmc-adds-silicon-photonics-coupe-roadmap-128tbps-on-package,,40241694,story,"TSMC Jumps into Silicon Photonics, Lays Out Roadmap for 12.8 Tbps Interconnect","[40242304, 40242219, 40246029]",20
vdelitz,182,1714503127,https://www.corbado.com/blog/passkey-implementation-pitfalls-misconceptions-unknowns,,40214736,story,"Passkey Implementation: Misconceptions, pitfalls and unknown unknowns","[40243137, 40245069, 40243745, 40243335, 40242327, 40245692, 40242809, 40243298, 40243039, 40245084, 40242011, 40242370, 40244847, 40244873, 40243383, 40242460, 40245597, 40243547, 40242966, 40243604, 40242824]",176
koevet,117,1714541497,https://www.nytimes.com/2024/04/30/books/paul-auster-dead.html,,40219823,story,Paul Auster has died,"[40226741, 40226990, 40228059, 40229432, 40221405, 40226755, 40224411, 40220491, 40232144, 40221636, 40233924, 40226869, 40228812, 40227891, 40226666, 40227938, 40227006, 40229155]",44
stalfosknight,171,1714771952,https://arstechnica.com/information-technology/2024/05/microsoft-ties-executive-pay-to-security-following-multiple-failures-and-breaches/,,40252619,story,Microsoft ties executive pay to security after multiple failures and breaches,"[40253231, 40252930, 40253025, 40253276, 40253008, 40252969, 40253125, 40252984, 40252898, 40253599, 40253202, 40254049, 40253152, 40253703, 40254803, 40252947, 40253486, 40253214, 40253706, 40253308, 40253255]",98
bschne,469,1714543734,https://medium.com/@anastasia.bizyayeva/every-map-of-china-is-wrong-bc2bce145db2,,40220072,story,Every map of China is wrong,"[40220434, 40245011, 40244714, 40241786, 40243355, 40248255, 40220375, 40244645, 40243481, 40246072, 40244105, 40243314, 40245795, 40249787, 40248254, 40247515, 40246118, 40243501, 40243941, 40220143, 40243218, 40242917, 40242757, 40245469, 40246280, 40244039, 40243749, 40245642, 40244377, 40248188, 40244969, 40246905, 40244234, 40243032, 40242833, 40220793]",253
gmjosack,259,1714517656,https://www.androidauthority.com/rabbit-r1-is-an-android-app-3438805/,,40217453,story,The Rabbit R1 is probably running Android and is powered by an Android app,"[40228458, 40223506, 40218712, 40222157, 40226231, 40218945, 40218529, 40218435, 40226983, 40219695, 40218311, 40234550, 40231305, 40223456, 40218485, 40223500, 40217655, 40223723, 40226499, 40232464, 40228038, 40231729, 40223538, 40218586, 40226259, 40231889, 40229839, 40226013, 40218976, 40219055, 40224320, 40230551, 40219150, 40224123, 40219025, 40218990, 40221378, 40218426, 40218688, 40224041]",303
thunderbong,16,1714795194,https://arstechnica.com/security/2024/05/microsoft-plans-to-lock-down-windows-dns-like-never-before-heres-how/,,40254688,story,Microsoft plans to lock down Windows DNS like never before,"[40257641, 40257179]",2
